{
  "$schema": "../../chain.schema.json",
  "chainName": "blockxtestnet",
  "chainId": "blockx_19077-1",
  "prettyName": "BlockX-Atlantis-Testnet",
  "website": "https://www.blockxnet.com/",
  "status": "live",
  "networkType": "testnet",
  "bech32Prefix": "blockx",
  "daemonName": "blockxd",
  "nodeHome": "$HOME/.blockxd",
  "keyAlgos": [
    "ethsecp256k1"
  ],
  "staking": {
    "stakingTokens": [
      {
        "denom": "abcx"
      }
    ]
  }
}