{
  "$schema": "../chain.schema.json",
  "chainName": "mun",
  "website": "https://mun.money",
  "networkType": "mainnet",
  "prettyName": "Mun",
  "chainId": "mun-1",
  "bech32Prefix": "mun",
  "keyAlgos": [
    "secp256k1"
  ],
  "slip44": 118,
  "fees": {
    "feeTokens": [
      {
        "denom": "umun",
        "fixedMinGasPrice": 0.025
      }
    ]
  },
  "staking": {
    "stakingTokens": [
      {
        "denom": "umun"
      }
    ]
  },
  "codebase": {

  },
  "apis": {
    "rpc": [
      {
        "address": "https://mainnet1rpc.mun.money"
      },
      {
        "address": "https://mainnet-mun-rpc.konsortech.xyz"
      },
      {
        "address": "https://rpc.mun.tcnetwork.io"
      }
    ],
    "rest": [
      {
        "address": "https://mainnet1.mun.money"
      },
      {
        "address": "https://mainnet-mun-api.konsortech.xyz"
      },
      {
        "address": "https://rest.mun.tcnetwork.io"
      }
    ],
    "grpc": [

    ]
  },
  "explorers": [
    {
      "url": "https://explorer.mun.money/mun",
      "txPage": "https://explorer.mun.money/mun/${txHash}"
    },
    {
      "url": "https://explorer.indonode.net/mun/staking",
      "txPage": "https://explorer.indonode.net/mun/${txHash}"
    },
    {
      "url": "https://explorer.konsortech.xyz/mun/staking",
      "txPage": "https://explorer.konsortech.xyz/mun/${txHash}"
    },
    {
      "kind": "ping.pub",
      "url": "https://ping.pub/mun",
      "txPage": "https://ping.pub/mun/${txHash}"
    },
    {
      "kind": "TC Network",
      "url": "https://explorer.tcnetwork.io/mun",
      "txPage": "https://explorer.tcnetwork.io/mun/transaction/${txHash}"
    }
  ],
  "images": [
    {
      "png": "https://raw.githubusercontent.com/cosmos/chain-registry/master/mun/images/mun.png",
      "svg": "https://raw.githubusercontent.com/cosmos/chain-registry/master/mun/images/mun.svg",
      "theme": {
        "primaryColorHex": "#f6ba32"
      }
    }
  ]
}