{
  "$schema": "../chain.schema.json",
  "chainName": "highbury",
  "networkType": "mainnet",
  "website": "https://www.fury.black/",
  "prettyName": "Highbury",
  "chainId": "highbury_710-1",
  "bech32Prefix": "fury",
  "slip44": 459,
  "fees": {
    "feeTokens": [
      {
        "denom": "ufury",
        "lowGasPrice": 0.05,
        "averageGasPrice": 0.1,
        "highGasPrice": 0.25
      }
    ]
  },
  "staking": {
    "stakingTokens": [
      {
        "denom": "ufury"
      }
    ]
  },
  "codebase": {

  },
  "apis": {
    "rpc": [
      {
        "address": "https://gridiron.furya.io"
      }
    ],
    "rest": [
      {
        "address": "https://api-mainnet.furya.io/"
      }
    ],
    "grpc": [
      {
        "address": "api-mainnet.furya.io:9090"
      }
    ],
    "evmHttpJsonrpc": [
      {
        "address": "https://rest.furya.io/"
      }
    ]
  },
  "explorers": [
    {
      "kind": "pingpub",
      "url": "https://explorer.furya.wtf/",
      "txPage": "https://www.explorer.furya.wtf//txs/${txHash}",
      "accountPage": "https://explorer.furya.wtf//account/${accountAddress}"
    }
  ],
  "images": [
    {
      "png": "https://raw.githubusercontent.com/cosmos/chain-registry/master/highbury/images/fury.png",
      "svg": "https://raw.githubusercontent.com/cosmos/chain-registry/master/highbury/images/fury.svg",
      "theme": {
        "primaryColorHex": "#040404"
      }
    }
  ]
}