{
  "$schema": "../chain.schema.json",
  "chainName": "onex",
  "website": "https://app.onomy.io/",
  "networkType": "mainnet",
  "prettyName": "ONEX",
  "chainId": "onex-mainnet-1",
  "bech32Prefix": "onomy",
  "keyAlgos": [
    "secp256k1"
  ],
  "slip44": 118,
  "fees": {
    "feeTokens": [
      {
        "denom": "aonex",
        "fixedMinGasPrice": 0,
        "lowGasPrice": 0,
        "averageGasPrice": 0.025,
        "highGasPrice": 0.04
      }
    ]
  },
  "staking": {
    "stakingTokens": [
      {
        "denom": "aonex"
      }
    ]
  },
  "codebase": {
    "cosmosSdkVersion": "0.45.16"
  },
  "images": [
    {
      "png": "https://raw.githubusercontent.com/cosmos/chain-registry/master/onex/images/onex.png",
      "theme": {
        "primaryColorHex": "#000000"
      }
    }
  ],
  "apis": {
    "rpc": [
      {
        "address": "https://rpc.mainnet.onex.onomy.io"
      }
    ],
    "rest": [
      {
        "address": "https://rest.mainnet.onex.onomy.io"
      }
    ],
    "grpc": [
      {
        "address": "a.node.mainnet.onomy.io:19091"
      }
    ]
  },
  "explorers": [
    {
      "kind": "Dexplorer - must enter rpc link provided above",
      "url": "https://dexplorer.cakralabs.site",
      "txPage": "https://dexplorer.cakralabs.site/txs/${txHash}",
      "accountPage": "https://dexplorer.cakralabs.site/${accountAddress}"
    }
  ]
}