{
  "$schema": "../../chain.schema.json",
  "chainName": "neuradevnet",
  "chainId": "neura_268-1",
  "bech32Prefix": "neura",
  "prettyName": "Neura Devnet",
  "website": "https://www.neuraprotocol.io/",
  "description": "Neura is an AI-centric, EVM-compatible Layer 1 blockchain built on the Cosmos SDK. We democratize GPU access and revolutionize AI project funding with IMOâ€™s to advance AI development.",
  "networkType": "devnet",
  "keyAlgos": [
    "ethsecp256k1"
  ],
  "extraCodecs": [
    "ethermint"
  ],
  "slip44": 1,
  "fees": {
    "feeTokens": [
      {
        "denom": "atankr"
      }
    ]
  },
  "staking": {
    "stakingTokens": [
      {
        "denom": "atankr"
      }
    ]
  },
  "codebase": {

  },
  "images": [
    {
      "imageSync": {
        "chainName": "neura"
      },
      "png": "https://raw.githubusercontent.com/cosmos/chain-registry/master/neura/images/neura.png",
      "theme": {
        "primaryColorHex": "#4e5afc"
      }
    }
  ]
}