{
  "$schema": "../../chain.schema.json",
  "chainName": "sunrisetestnet",
  "status": "live",
  "networkType": "testnet",
  "prettyName": "Sunrise Testnet",
  "chainId": "sunrise-test",
  "bech32Prefix": "sunrise",
  "daemonName": "sunrised",
  "nodeHome": "$HOME/.sunrise",
  "keyAlgos": [
    "secp256k1"
  ],
  "slip44": 118,
  "fees": {
    "feeTokens": [
      {
        "denom": "urise",
        "fixedMinGasPrice": 0,
        "lowGasPrice": 0.0025,
        "averageGasPrice": 0.025,
        "highGasPrice": 0.04
      }
    ]
  },
  "staking": {
    "stakingTokens": [
      {
        "denom": "uvrise"
      }
    ]
  },
  "codebase": {
    "gitRepo": "https://github.com/sunriselayer/sunrise",
    "recommendedVersion": "v0.1.1",
    "compatibleVersions": [
      "v0.1.1"
    ],
    "binaries": {
      "linux/amd64": "https://github.com/sunriselayer/sunrise/releases/download/v0.1.1/sunrised"
    },
    "cosmosSdkVersion": "0.50.2",
    "consensus": {
      "type": "cometbft",
      "version": "sunriselayer/sunrise-core v0.0.5-cmt-v0.38.2"
    },
    "ibcGoVersion": "8.0.0",
    "versions": [
      {
        "name": "v0.0.7",
        "recommendedVersion": "v0.0.7",
        "compatibleVersions": [
          "v0.0.7"
        ],
        "binaries": {
          "linux/amd64": "https://github.com/sunriselayer/sunrise/releases/download/v0.0.7/sunrised"
        },
        "cosmosSdkVersion": "0.50.2",
        "consensus": {
          "type": "cometbft",
          "version": "sunriselayer/sunrise-core v0.0.5-cmt-v0.38.2"
        },
        "ibcGoVersion": "8.0.0",
        "icsEnabled": [
          "ics20-1"
        ]
      },
      {
        "name": "v0.0.8",
        "recommendedVersion": "v0.0.8",
        "compatibleVersions": [
          "v0.0.8"
        ],
        "binaries": {
          "linux/amd64": "https://github.com/sunriselayer/sunrise/releases/download/v0.0.8/sunrised"
        },
        "cosmosSdkVersion": "0.50.2",
        "consensus": {
          "type": "cometbft",
          "version": "sunriselayer/sunrise-core v0.0.5-cmt-v0.38.2"
        },
        "ibcGoVersion": "8.0.0",
        "icsEnabled": [
          "ics20-1"
        ]
      },
      {
        "name": "v0.1.1",
        "recommendedVersion": "v0.1.1",
        "compatibleVersions": [
          "v0.1.1"
        ],
        "binaries": {
          "linux/amd64": "https://github.com/sunriselayer/sunrise/releases/download/v0.1.1/sunrised"
        },
        "cosmosSdkVersion": "0.50.2",
        "consensus": {
          "type": "cometbft",
          "version": "sunriselayer/sunrise-core v0.0.5-cmt-v0.38.2"
        },
        "ibcGoVersion": "8.0.0",
        "icsEnabled": [
          "ics20-1"
        ]
      }
    ]
  },
  "logoURIs": {
    "png": "https://raw.githubusercontent.com/cosmos/chain-registry/master/sunrise/images/sunrise.png",
    "svg": "https://raw.githubusercontent.com/cosmos/chain-registry/master/sunrise/images/sunrise.svg"
  },
  "peers": {
    "seeds": [

    ],
    "persistentPeers": [

    ]
  },
  "apis": {
    "rpc": [
      {
        "address": "https://sunrise-test-1.cauchye.net/",
        "provider": "CauchyE"
      }
    ],
    "rest": [
      {
        "address": "https://sunrise-test-1.cauchye.net:1318",
        "provider": "CauchyE"
      }
    ],
    "grpc": [
      {
        "address": "https://sunrise-test-1.cauchye.net:9092",
        "provider": "CauchyE"
      }
    ]
  },
  "explorers": [

  ],
  "images": [
    {
      "svg": "https://raw.githubusercontent.com/cosmos/chain-registry/master/sunrise/images/sunrise.svg",
      "png": "https://raw.githubusercontent.com/cosmos/chain-registry/master/sunrise/images/sunrise.png"
    }
  ]
}