{
  "$schema": "../chain.schema.json",
  "chainName": "impacthub",
  "status": "live",
  "networkType": "mainnet",
  "website": "https://www.ixo.world/",
  "prettyName": "Impacts Hub",
  "chainId": "ixo-5",
  "bech32Prefix": "ixo",
  "daemonName": "ixod",
  "nodeHome": "$HOME/.ixod",
  "keyAlgos": [
    "secp256k1",
    "ed25519"
  ],
  "slip44": 118,
  "fees": {
    "feeTokens": [
      {
        "denom": "uixo",
        "fixedMinGasPrice": 0.025,
        "lowGasPrice": 0.025,
        "averageGasPrice": 0.025,
        "highGasPrice": 0.04
      }
    ]
  },
  "staking": {
    "stakingTokens": [
      {
        "denom": "uixo"
      }
    ]
  },
  "codebase": {
    "gitRepo": "https://github.com/ixofoundation/ixo-blockchain",
    "recommendedVersion": "v3.0.0",
    "compatibleVersions": [
      "v3.0.0"
    ],
    "cosmosSdkVersion": "v0.45.16",
    "ibcGoVersion": "v4.4.1",
    "consensus": {
      "type": "cometbft",
      "version": "v0.34.27"
    },
    "genesis": {
      "genesisUrl": "https://github.com/ixofoundation/genesis/raw/bc042e1223d551b22d55c155de06e662ca24d2f2/ixo-5/genesis.json.tar.gz"
    },
    "versions": [
      {
        "name": "v0.20.0",
        "proposal": 403,
        "height": 1254500,
        "recommendedVersion": "v0.20.1",
        "compatibleVersions": [
          "v0.20.0",
          "v0.20.1"
        ],
        "cosmosSdkVersion": "v0.45.12",
        "ibcGoVersion": "v4.3.0",
        "consensus": {
          "type": "tendermint",
          "version": "v0.34.24"
        },
        "nextVersionName": "v2"
      },
      {
        "name": "v2",
        "proposal": 439,
        "height": 2383000,
        "recommendedVersion": "v2.0.0",
        "compatibleVersions": [
          "v2.0.0"
        ],
        "cosmosSdkVersion": "v0.45.16",
        "ibcGoVersion": "v4.4.1",
        "consensus": {
          "type": "cometbft",
          "version": "v0.34.27"
        },
        "nextVersionName": "v3"
      },
      {
        "name": "v3",
        "proposal": 447,
        "height": 6556300,
        "recommendedVersion": "v3.0.0",
        "compatibleVersions": [
          "v3.0.0"
        ],
        "cosmosSdkVersion": "v0.45.16",
        "ibcGoVersion": "v4.4.1",
        "consensus": {
          "type": "cometbft",
          "version": "v0.34.27"
        },
        "nextVersionName": ""
      }
    ]
  },
  "logoURIs": {
    "png": "https://raw.githubusercontent.com/cosmos/chain-registry/master/impacthub/images/ixo.png",
    "svg": "https://raw.githubusercontent.com/cosmos/chain-registry/master/impacthub/images/ixo.svg"
  },
  "peers": {
    "seeds": [
      {
        "id": "36e4738c7efcf353d3048e5e6073406d045bae9d",
        "address": "80.64.208.43:26656",
        "provider": "simplyvc"
      },
      {
        "id": "20e1000e88125698264454a884812746c2eb4807",
        "address": "seeds.lavenderfive.com:16656",
        "provider": "Lavender.Five Nodes üêù"
      },
      {
        "id": "8542cd7e6bf9d260fef543bc49e59be5a3fa9074",
        "address": "seed.publicnode.com:26656",
        "provider": "Allnodes ‚ö°Ô∏è Nodes & Staking"
      },
      {
        "id": "9194ed56c5b93a0a7e3bdbcad8f62467f7137f56",
        "address": "seed-ixo.ibs.team:16662",
        "provider": "Inter Blockchain Services"
      }
    ],
    "persistentPeers": [
      {
        "id": "36e4738c7efcf353d3048e5e6073406d045bae9d",
        "address": "80.64.208.43:26656",
        "provider": "simplyvc"
      },
      {
        "id": "d4448c5b10b43d444034533ede7d2e66cbf9e519",
        "address": "ixo.peer.stavr.tech:1016",
        "provider": "üî•STAVRüî•"
      }
    ]
  },
  "apis": {
    "rpc": [
      {
        "address": "https://proxies.sifchain.finance/api/impacthub-3/rpc",
        "provider": "sifchain"
      },
      {
        "address": "https://impacthub.ixo.world/rpc/",
        "provider": "ixoworld"
      },
      {
        "address": "https://ixo.rpc.m.stavr.tech:443",
        "provider": "üî•STAVRüî•"
      },
      {
        "address": "https://rpc-ixo-ia.cosmosia.notional.ventures/",
        "provider": "Notional"
      },
      {
        "address": "https://impacthub-rpc.lavenderfive.com/",
        "provider": "Lavender.Five Nodes üêù"
      },
      {
        "address": "https://ixo-rpc.ibs.team",
        "provider": "Inter Blockchain Services"
      }
    ],
    "rest": [
      {
        "address": "https://proxies.sifchain.finance/api/impacthub-3/rest",
        "provider": "sifchain"
      },
      {
        "address": "https://impacthub.ixo.world/rest/",
        "provider": "ixoworld"
      },
      {
        "address": "https://ixo.api.m.stavr.tech",
        "provider": "üî•STAVRüî•"
      },
      {
        "address": "https://api-ixo-ia.cosmosia.notional.ventures/",
        "provider": "Notional"
      },
      {
        "address": "https://impacthub-api.lavenderfive.com/",
        "provider": "Lavender.Five Nodes üêù"
      },
      {
        "address": "https://ixo-api.ibs.team",
        "provider": "Inter Blockchain Services"
      }
    ],
    "grpc": [
      {
        "address": "grpc-ixo-ia.cosmosia.notional.ventures:443",
        "provider": "Notional"
      },
      {
        "address": "ixo.grpc.m.stavr.tech:2010",
        "provider": "üî•STAVRüî•"
      },
      {
        "address": "impacthub-grpc.lavenderfive.com:443",
        "provider": "Lavender.Five Nodes üêù"
      }
    ]
  },
  "explorers": [
    {
      "kind": "ezstaking",
      "url": "https://ezstaking.app/ixo",
      "txPage": "https://ezstaking.app/ixo/txs/${txHash}",
      "accountPage": "https://ezstaking.app/ixo/account/${accountAddress}"
    },
    {
      "kind": "üî•STAVRüî•",
      "url": "https://explorer.stavr.tech/IXO-Mainnet",
      "txPage": "https://explorer.stavr.tech/IXO-Mainnet/txs/${txHash}",
      "accountPage": "https://explorer.stavr.tech/IXO-Mainnet/account/${accountAddress}"
    },
    {
      "kind": "bigdipper",
      "url": "https://blockscan.ixo.world",
      "txPage": "https://blockscan.ixo.world/transactions/${txHash}"
    },
    {
      "kind": "ping.pub",
      "url": "https://ping.pub/ixo",
      "txPage": "https://ping.pub/ixo/tx/${txHash}"
    },
    {
      "kind": "atomscan",
      "url": "https://atomscan.com/ixo",
      "txPage": "https://atomscan.com/ixo/transactions/${txHash}",
      "accountPage": "https://atomscan.com/ixo/accounts/${accountAddress}"
    },
    {
      "kind": "Mintscan",
      "url": "https://www.mintscan.io/ixo",
      "txPage": "https://www.mintscan.io/ixo/transactions/${txHash}",
      "accountPage": "https://www.mintscan.io/ixo/accounts/${accountAddress}"
    }
  ],
  "images": [
    {
      "png": "https://raw.githubusercontent.com/cosmos/chain-registry/master/impacthub/images/ixo.png",
      "svg": "https://raw.githubusercontent.com/cosmos/chain-registry/master/impacthub/images/ixo.svg"
    }
  ]
}